{
  "$schema": "https://json-schema.org/draft/2020-12/schema",
  "$id": "https://chessview.org/schemas/news-run-manifest.schema.json",
  "title": "Agentic News Run Manifest",
  "type": "object",
  "additionalProperties": false,
  "required": [
    "schemaVersion",
    "runId",
    "sourceSlug",
    "sourceName",
    "objective",
    "startedAt",
    "status",
    "agent",
    "queryUsed",
    "urlsVisited",
    "evidenceFiles",
    "candidatesCreated",
    "rejectedItems",
    "errors",
    "nextSuggestion"
  ],
  "properties": {
    "schemaVersion": {
      "type": "integer",
      "const": 1
    },
    "runId": {
      "type": "string",
      "minLength": 8
    },
    "sourceSlug": {
      "type": "string",
      "pattern": "^[a-z0-9]+(?:-[a-z0-9]+)*$"
    },
    "sourceName": {
      "type": "string",
      "minLength": 2
    },
    "objective": {
      "type": "string",
      "minLength": 5
    },
    "startedAt": {
      "type": "string",
      "format": "date-time"
    },
    "finishedAt": {
      "type": ["string", "null"],
      "format": "date-time"
    },
    "status": {
      "type": "string",
      "enum": ["planned", "running", "completed", "completed_with_warnings", "failed"]
    },
    "agent": {
      "type": "string",
      "minLength": 2
    },
    "queryUsed": {
      "type": "array",
      "items": {
        "type": "string"
      }
    },
    "urlsVisited": {
      "type": "array",
      "items": {
        "type": "object",
        "additionalProperties": false,
        "required": ["url", "checkedAt", "status"],
        "properties": {
          "url": {
            "type": "string",
            "format": "uri"
          },
          "canonicalUrl": {
            "type": "string",
            "format": "uri"
          },
          "checkedAt": {
            "type": "string",
            "format": "date-time"
          },
          "status": {
            "type": "string",
            "enum": ["visited", "skipped", "blocked", "paywalled", "error"]
          },
          "notes": {
            "type": "string"
          }
        }
      }
    },
    "evidenceFiles": {
      "type": "array",
      "items": {
        "type": "string"
      }
    },
    "candidatesCreated": {
      "type": "array",
      "items": {
        "type": "string"
      }
    },
    "rejectedItems": {
      "type": "array",
      "items": {
        "type": "object",
        "additionalProperties": false,
        "required": ["fingerprint", "reason"],
        "properties": {
          "fingerprint": {
            "type": "string"
          },
          "reason": {
            "type": "string"
          },
          "path": {
            "type": "string"
          }
        }
      }
    },
    "errors": {
      "type": "array",
      "items": {
        "type": "object",
        "additionalProperties": false,
        "required": ["message", "severity"],
        "properties": {
          "message": {
            "type": "string"
          },
          "severity": {
            "type": "string",
            "enum": ["info", "warning", "error"]
          },
          "url": {
            "type": "string",
            "format": "uri"
          }
        }
      }
    },
    "nextSuggestion": {
      "type": "string"
    }
  }
}

