{
  "schemaVersion": 1,
  "runId": "2026-07-03-1800-example-news",
  "sourceSlug": "example-news",
  "sourceName": "Example News",
  "objective": "Simulate a supervised news discovery run with one approved-style candidate and one low-confidence discovery lead.",
  "startedAt": "2026-07-03T16:00:00Z",
  "finishedAt": "2026-07-03T16:25:00Z",
  "status": "completed_with_warnings",
  "agent": "codex-example",
  "queryUsed": [
    "site:example.org chess news July 2026",
    "Example News chess grand prix Milan 2026"
  ],
  "urlsVisited": [
    {
      "url": "https://example.org/news/grand-prix-final-milan-2026",
      "canonicalUrl": "https://example.org/news/grand-prix-final-milan-2026",
      "checkedAt": "2026-07-03T16:00:00Z",
      "status": "visited",
      "notes": "Candidate created."
    },
    {
      "url": "https://example.org/social/junior-team-selection",
      "canonicalUrl": "https://example.org/social/junior-team-selection",
      "checkedAt": "2026-07-03T16:15:00Z",
      "status": "visited",
      "notes": "Low-confidence discovery candidate created."
    },
    {
      "url": "https://example.org/repost/grand-prix-final-milan",
      "canonicalUrl": "https://example.org/repost/grand-prix-final-milan",
      "checkedAt": "2026-07-03T16:20:00Z",
      "status": "skipped",
      "notes": "Duplicate repost of the same example story."
    }
  ],
  "evidenceFiles": [
    "runs/2026-07-03/1800-example-news/evidence-001.md",
    "runs/2026-07-03/1800-example-news/evidence-002.md"
  ],
  "candidatesCreated": [
    "examples/news-candidate.example.json",
    "examples/news-candidate-low-confidence.example.json"
  ],
  "rejectedItems": [
    {
      "fingerprint": "2026-07-03|example-grand-prix-final-announced-for-milan",
      "reason": "Duplicate repost in example run.",
      "path": "examples/rejected-news.example.json"
    }
  ],
  "errors": [
    {
      "message": "Example run includes one low-confidence discovery item for review testing.",
      "severity": "warning"
    }
  ],
  "nextSuggestion": "Approve the Grand Prix example and keep the junior team selection lead in candidates until a primary source confirms it."
}

